{
  "protocol_version": "agent.v1",
  "runtime_version": "0.1.0",
  "run_id": "run_018f0000-0000-7000-8000-000000000000",
  "agent_id": "echo_agent",
  "agent_version": "0.1.0",
  "started_at": "2026-06-28T09:12:31Z",
  "finished_at": "2026-06-28T09:12:32Z",
  "input": {
    "message": "hello runtime"
  },
  "output": {
    "message": "hello runtime"
  },
  "events": [
    {
      "kind": "run_started",
      "occurred_at": "2026-06-28T09:12:31Z",
      "payload": {
        "agent_id": "echo_agent"
      }
    }
  ]
}
